<!-- 
 * Licensed to The Apereo Foundation under one or more contributor license
 * agreements. See the NOTICE file distributed with this work for
 * additional information regarding copyright ownership.
 *
 * The Apereo Foundation licenses this file to you under the Apache License,
 * Version 2.0 (the "License"); you may not use this file except in
 * compliance with the License. You may obtain a copy of the License at:
 *
 * http://www.apache.org/licenses/LICENSE-2.0
 *
 * Unless required by applicable law or agreed to in writing, software
 * distributed under the License is distributed on an "AS IS" BASIS,
 * WITHOUT WARRANTIES OR CONDITIONS OF ANY KIND, either express or implied.
 *
 * See the License for the specific language governing permissions and
 * limitations under the License.
 * 
 -->

<!ELEMENT studentAdvisors ( studentAdvisor+ ) >
<!ATTLIST studentAdvisors campus CDATA #REQUIRED >
<!ATTLIST studentAdvisors term CDATA #REQUIRED >
<!ATTLIST studentAdvisors year CDATA #REQUIRED >
<!ATTLIST studentAdvisors incremental (true | false) #IMPLIED >
<!ATTLIST studentAdvisors created CDATA #IMPLIED >

<!ELEMENT studentAdvisor ( updateStudents? ) >
<!ATTLIST studentAdvisor externalId CDATA #REQUIRED >
<!ATTLIST studentAdvisor role CDATA #REQUIRED >
<!ATTLIST studentAdvisor firstName CDATA #IMPLIED >
<!ATTLIST studentAdvisor middleName CDATA #IMPLIED >
<!ATTLIST studentAdvisor lastName CDATA #IMPLIED >
<!ATTLIST studentAdvisor acadTitle CDATA #IMPLIED >
<!ATTLIST studentAdvisor email CDATA #IMPLIED >

<!ELEMENT updateStudents ( student+ ) >

<!ELEMENT student EMPTY >
<!ATTLIST student externalId CDATA #REQUIRED >